,0
2,"
      Transcript
      My fellow Americans, tonight for the first time in 79 days, the skies over Yugoslavia are silent. The Serb army and police are withdrawing from Kosovo. The one million men, women, and children driven from their land are preparing to return home. The demands of an outraged and united international community have been met.
I can report to the American people that we have achieved a victory for a safer world, for our democratic values, and for a stronger America. Our pilots have returned to base. The airstrikes have been suspended. Aggression against an innocent people has been contained and is being turned back.
When I ordered our Armed Forces into combat, we had three clear goals: to enable the Kosovar people, the victims of some of the most vicious atrocities in Europe since the Second World War, to return to their homes with safety and self-government; to require Serbian forces responsible for those atrocities to leave Kosovo; and to deploy an international security force, with NATO at its core, to protect all the people of that troubled land, Serbs and Albanians, alike. Those goals will be achieved. A necessary conflict has been brought to a just and honorable conclusion.
The result will be security and dignity for the people of Kosovo, achieved by an alliance that stood together in purpose and resolve, assisted by the diplomatic efforts of Russia. This victory brings a new hope that when a people are singled out for destruction because of their heritage and religious faith and we can do something about it, the world will not look the other way.
I want to express my profound gratitude to the men and women of our Armed Forces and those of our Allies. Day after day, night after night, they flew, risking their lives to attack their targets and to avoid civilian casualties when they were fired upon from populated areas. I ask every American to join me in saying to them, thank you, you've made us very proud.
I'm also grateful to the American people for standing against the awful ethnic cleansing, for sending generous assistance to the refugees, and for opening your hearts and your homes to the innocent victims who came here.
I want to speak with you for a few moments tonight about why we fought, what we achieved, and what we have to do now to advance the peace, and together with the people of the Balkans, forge a future of freedom, progress, and harmony.
We should remember that the violence we responded to in Kosovo was the culmination of a 10-year campaign by Slobodan Milosevic, the leader of Serbia, to exploit ethnic and religious differences in order to impose his will on the lands of the former Yugoslavia. That's what he tried to do in Croatia and in Bosnia, and now in Kosovo. The world saw the terrifying consequences: 500 villages burned; men of all ages separated from their loved ones to be shot and buried in mass graves; women raped; children made to watch their parents die; a whole people forced to abandon, in hours, communities their families had spent generations building.
For these atrocities, Mr. Milosevic and his top aides have been indicted by the International War Crimes Tribunal for war crimes and crimes against humanity. I will never forget the Kosovar refugees I recently met. Some of them could barely talk about what they had been through. All they had left was hope that the world would not turn its back.
When our diplomatic efforts to avert this horror were rebuffed and the violence mounted, we and our Allies chose to act. Mr. Milosevic continued to do terrible things to the people of Kosovo, but we were determined to turn him back. Our firmness finally has brought an end to a vicious campaign of ethnic cleansing, and we acted early enough to reverse it, to enable the Kosovars to go home.
When they do, they will be safe. They will be able to reopen their schools, speak their language, practice their religion, choose their leaders, and shape their destiny. There'll be no more days of foraging for food in the cold of mountains and forests, no more nights of hiding in cellars, wondering if the next day will bring death or deliverance. They will know that Mr. Milosevic's army and paramilitary forces will be gone, his 10-year campaign of repression finished.
NATO has achieved this success as a united alliance, ably led by Secretary General Solana and General Clark. Nineteen democracies came together and stayed together through the stiffest military challenge in NATO's 50-year history.
We also preserved our critically important partnership with Russia, thanks to President Yeltsin, who opposed our military effort but supported diplomacy to end the conflict on terms that met our conditions. I'm grateful to Russian envoy Chernomyrdin and Finnish President Ahtisaari for their work, and to Vice President Gore for the key role he played in putting their partnership together. Now, I hope Russian troops will join us in the force that will keep the peace in Kosovo, just as they have in Bosnia.
Finally, we have averted the wider war this conflict might well have sparked. The countries of southeastern Europe backed the NATO campaign, helped the refugees, and showed the world there is more compassion than cruelty in this troubled region. This victory makes it all the more likely that they will choose a future of democracy, fair treatment of minorities, and peace.
Now we're entering a new phase, building that peace, and there are formidable challenges. First, we must be sure the Serbian authorities meet their commitments. We are prepared to resume our military campaign should they fail to do so. Next, we must get the Kosovar refugees home safely; mine fields will have to be cleared; homes destroyed by Serb forces will have to be rebuilt; homeless people in need of food and medicine will have to get them; the fate of the missing will have to be determined; the Kosovar Liberation Army will have to demilitarize, as it has agreed to do. And we in the peacekeeping force will have to ensure that Kosovo is a safe place to live for all its citizens, ethnic Serbs as well as ethnic Albanians.
For these things to happen, security must be established. To that end, some 50,000 troops from almost 30 countries will deploy to Kosovo. Our European Allies will provide the vast majority of them; America will contribute about 7,000. We are grateful that during NATO's air campaign we did not lose a single serviceman in combat. But this next phase also will be dangerous. Bitter memories will still be fresh, and there may well be casualties. So we have made sure that the force going into Kosovo will have NATO command and control and rules of engagement set by NATO. It will have the means and the mandate to protect itself while doing its job.
In the meantime, the United Nations will organize a civilian administration while preparing the Kosovars to govern and police themselves. As local institutions take hold, NATO will be able to turn over increasing responsibility to them and draw down its forces.
A third challenge will be to put in place a plan for lasting peace and stability in Kosovo and through all the Balkans. For that to happen, the European Union and the United States must plan for tomorrow, not just today. We must help to give the democracies of southeastern Europe a path to a prosperous, shared future, a unifying magnet more powerful than the pull of hatred and destruction that has threatened to tear them apart. Our European partners must provide most of the resources for this effort, but it is in America's interest to do our part, as well. A final challenge will be to encourage Serbia to join its neighbors in this historic journey to a peaceful, democratic, united Europe.
I want to say a few words to the Serbian people tonight. I know that you, too, have suffered in Mr. Milosevic's wars. You should know that your leaders could have kept Kosovo as a part of your country without driving a single Kosovar family from its home, without killing a single adult or child, without inviting a single NATO bomb to fall on your country. You endured 79 days of bombing, not to keep Kosovo a province of Serbia, but simply because Mr. Milosevic was determined to eliminate Kosovar Albanians from Kosovo, dead or alive.
As long as he remains in power, as long as your nation is ruled by an indicted war criminal, we will provide no support for the reconstruction of Serbia. But we are ready to provide humanitarian aid now and to help to build a better future for Serbia, too, when its Government represents tolerance and freedom, not repression and terror.
My fellow Americans, all these challenges are substantial, but they are far preferable to the challenges of war and continued instability in Europe. We have sent a message of determination and hope to all the world. Think of all the millions of innocent people who died in this bloody century because democracies reacted too late to evil and aggression. Because of our resolve, the 20th century is ending not with helpless indignation but with a hopeful affirmation of human dignity and human rights for the 21st century.
In a world too divided by fear among people of different racial, ethnic, and religious groups, we have given confidence to the friends of freedom and pause to those who would exploit human difference for inhuman purposes.
America still faces great challenges in this world, but we look forward to meeting them. So, tonight I ask you to be proud of your country and very proud of the men and women who serve it in uniform. For in Kosovo, we did the right thing; we did it the right way; and we will finish the job.
Good night, and may God bless our wonderful United States of America.

    "
3,"
      Transcript
      My fellow Americans, today our Armed Forces joined our NATO allies in airstrikes against Serbian forces responsible for the brutality in Kosovo. We have acted with resolve for several reasons.
We act to protect thousands of innocent people in Kosovo from a mounting military offensive. We act to prevent a wider war, to diffuse a powder keg at the heart of Europe that has exploded twice before in this century with catastrophic results. And we act to stand united with our allies for peace. By acting now, we are upholding our values, protecting our interests, and advancing the cause of peace.
Tonight I want to speak to you about the tragedy in Kosovo and why it matters to America that we work with our allies to end it. First, let me explain what it is we are responding to. Kosovo is a province of Serbia, in the middle of southeastern Europe, about 160 miles east of Italy. That's less than the distance between Washington and New York and only about 70 miles north of Greece. Its people are mostly ethnic Albanian and mostly Muslim.
In 1989 Serbia's leader, Slobodan Milosevic, the same leader who started the wars in Bosnia and Croatia and moved against Slovenia in the last decade, stripped Kosovo of the constitutional autonomy its people enjoyed, thus denying them their right to speak their language, run their schools, shape their daily lives. For years, Kosovars struggled peacefully to get their rights back. When President Milosevic sent his troops and police to crush them, the struggle grew violent.
Last fall our diplomacy, backed by the threat of force from our NATO alliance, stopped the fighting for a while and rescued tens of thousands of people from freezing and starvation in the hills where they had fled to save their lives. And last month, with our allies and Russia, we proposed a peace agreement to end the fighting for good. The Kosovar leaders signed that agreement last week. Even though it does not give them all they want, even though their people were still being savaged, they saw that a just peace is better than a long and unwinnable war.
The Serbian leaders, on the other hand, refused even to discuss key elements of the peace agreement. As the Kosovars were saying yes to peace, Serbia stationed 40,000 troops in and around Kosovo in preparation for a major offensive—and in clear violation of the commitments they had made.
Now they've started moving from village to village, shelling civilians and torching their houses. We've seen innocent people taken from their homes, forced to kneel in the dirt, and sprayed with bullets; Kosovar men dragged from their families, fathers and sons together, lined up and shot in cold blood. This is not war in the traditional sense. It is an attack by tanks and artillery on a largely defenseless people whose leaders already have agreed to peace.
Ending this tragedy is a moral imperative. It is also important to America's national interest. Take a look at this map. Kosovo is a small place, but it sits on a major fault line between Europe, Asia, and the Middle East, at the meeting place of Islam and both the Western and Orthodox branches of Christianity. To the south are our allies, Greece and Turkey; to the north, our new democratic allies in central Europe. And all around Kosovo there are other small countries struggling with their own economic and political challenges, countries that could be overwhelmed by a large, new wave of refugees from Kosovo. All the ingredients for a major war are there: ancient grievances, struggling democracies, and in the center of it all a dictator in Serbia who has done nothing since the cold war ended but start new wars and pour gasoline on the flames of ethnic and religious division.
Sarajevo, the capital of neighboring Bosnia, is where World War I began. World War II and the Holocaust engulfed this region. In both wars, Europe was slow to recognize the dangers, and the United States waited even longer to enter the conflicts. Just imagine if leaders back then had acted wisely and early enough, how many lives could have been saved, how many Americans would not have had to die.
We learned some of the same lessons in Bosnia just a few years ago. The world did not act early enough to stop that war, either. And let's not forget what happened: innocent people herded into concentration camps, children gunned down by snipers on their way to school, soccer fields and parks turned into cemeteries, a quarter of a million people killed, not because of anything they have done but because of who they were. Two million Bosnians became refugees. This was genocide in the heart of Europe, not in 1945 but in 1995; not in some grainy newsreel from our parents' and grandparents' time but in our own time, testing our humanity and our resolve.
At the time, many people believed nothing could be done to end the bloodshed in Bosnia. They said, ""Well, that's just the way those people in the Balkans are."" But when we and our allies joined with courageous Bosnians to stand up to the aggressors, we helped to end the war. We learned that in the Balkans, inaction in the face of brutality simply invites more brutality, but firmness can stop armies and save lives. We must apply that lesson in Kosovo before what happened in Bosnia happens there, too.
Over the last few months we have done everything we possibly could to solve this problem peacefully. Secretary Albright has worked tirelessly for a negotiated agreement. Mr. Milosevic has refused.
On Sunday I sent Ambassador Dick Holbrooke to Serbia to make clear to him again, on behalf of the United States and our NATO allies, that he must honor his own commitments and stop his repression, or face military action. Again, he refused.
Today we and our 18 NATO allies agreed to do what we said we would do, what we must do to restore the peace. Our mission is clear: to demonstrate the seriousness of NATO's purpose so that the Serbian leaders understand the imperative of reversing course; to deter an even bloodier offensive against innocent civilians in Kosovo and, if necessary, to seriously damage the Serbian military's capacity to harm the people of Kosovo. In short, if President Milosevic will not make peace, we will limit his ability to make war.
Now, I want to be clear with you, there are risks in this military action, risks to our pilots and the people on the ground. Serbia's air defenses are strong. It could decide to intensify its assault on Kosovo or to seek to harm us or our allies elsewhere. If it does, we will deliver a forceful response.
Hopefully, Mr. Milosevic will realize his present course is self-destructive and unsustainable. If he decides to accept the peace agreement and demilitarize Kosovo, NATO has agreed to help to implement it with a peacekeeping force. If NATO is invited to do so, our troops should take part in that mission to keep the peace. But I do not intend to put our troops in Kosovo to fight a war.
Do our interests in Kosovo justify the dangers to our Armed Forces? I've thought long and hard about that question. I am convinced that the dangers of acting are far outweighed by the dangers of not acting—dangers to defenseless people and to our national interests. If we and our allies were to allow this war to continue with no response, President Milosevic would read our hesitation as a license to kill. There would be many more massacres, tens of thousands more refugees, more victims crying out for revenge.
Right now our firmness is the only hope the people of Kosovo have to be able to live in their own country without having to fear for their own lives. Remember: We asked them to accept peace, and they did. We asked them to promise to lay down their arms, and they agreed. We pledged that we, the United States and the other 18 nations of NATO, would stick by them if they did the right thing. We cannot let them down now.
Imagine what would happen if we and our allies instead decided just to look the other way, as these people were massacred on NATO's doorstep. That would discredit NATO, the cornerstone on which our security has rested for 50 years now.
We must also remember that this is a conflict with no natural national boundaries. Let me ask you to look again at a map. The red dots are towns the Serbs have attacked. The arrows show the movement of refugees north, east, and south. Already, this movement is threatening the young democracy in Macedonia, which has its own Albanian minority and a Turkish minority. Already, Serbian forces have made forays into Albania from which Kosovars have drawn support. Albania has a Greek minority. Let a fire burn here in this area, and the flames will spread. Eventually, key U.S. allies could be drawn into a wider conflict, a war we would be forced to confront later, only at far greater risk and greater cost.
I have a responsibility as President to deal with problems such as this before they do permanent harm to our national interests. America has a responsibility to stand with our allies when they are trying to save innocent lives and preserve peace, freedom, and stability in Europe. That is what we are doing in Kosovo.
If we've learned anything from the century drawing to a close, it is that if America is going to be prosperous and secure, we need a Europe that is prosperous, secure, undivided, and free. We need a Europe that is coming together, not falling apart, a Europe that shares our values and shares the burdens of leadership. That is the foundation on which the security of our children will depend.
That is why I have supported the political and economic unification of Europe. That is why we brought Poland, Hungary, and the Czech Republic into NATO, and redefined its missions, and reached out to Russia and Ukraine for new partnerships.
Now, what are the challenges to that vision of a peaceful, secure, united, stable Europe?—the challenge of strengthening a partnership with a democratic Russia that, despite our disagreements, is a constructive partner in the work of building peace; the challenge of resolving the tension between Greece and Turkey and building bridges with the Islamic world; and finally, the challenge of ending instability in the Balkans so that these bitter ethnic problems in Europe are resolved by the force of argument, not the force of arms, so that future generations of Americans do not have to cross the Atlantic to fight another terrible war.
It is this challenge that we and our allies are facing in Kosovo. That is why we have acted now—because we care about saving innocent lives; because we have an interest in avoiding an even crueler and costlier war; and because our children need and deserve a peaceful, stable, free Europe.
Our thoughts and prayers tonight must be with the men and women of our Armed Forces who are undertaking this mission for the sake of our values and our children's future.
May God bless them, and may God bless America.

    "
