,0
5,"
      Transcript
      Good evening. This afternoon in this room, from this chair, I testified before the Office of Independent Counsel and the grand jury. I answered their questions truthfully, including questions about my private life, questions no American citizen would ever want to answer.

Still I must take complete responsibility for all my actions, both public and private. And that is why I am speaking to you tonight.

As you know, in a deposition in January I was asked questions about my relationship with Monica Lewinsky. While my answers were legally accurate, I did not volunteer information. Indeed, I did have a relationship with Ms. Lewinsky that was not appropriate. In fact, it was wrong. It constituted a critical lapse in judgment and a personal failure on my part for which I am solely and completely responsible.

But I told the grand jury today, and I say to you now, that at no time did I ask anyone to lie, to hide or destroy evidence, or to take any other unlawful action.

I know that my public comments and my silence about this matter gave a false impression. I misled people, including even my wife. I deeply regret that. I can only tell you I was motivated by many factors: first, by a desire to protect myself from the embarrassment of my own conduct. I was also very concerned about protecting my family. The fact that these questions were being asked in a politically inspired lawsuit which has since been dismissed was a consideration, too.

In addition, I had real and serious concerns about an Independent Counsel investigation that began with private business dealings 20 years ago, dealings, I might add, about which an independent Federal agency found no evidence of any wrongdoing by me or my wife over 2 years ago. The Independent Counsel investigation moved on to my staff and friends, then into my private life. And now the investigation itself is under investigation. This has gone on too long, cost too much, and hurt too many innocent people.

Now this matter is between me, the two people I love most, my wife and our daughter, and our God. I must put it right, and I am prepared to do whatever it takes to do so. Nothing is more important to me personally. But it is private. And I intend to reclaim my family life for my family. It's nobody's business but ours. Even Presidents have private lives.

It is time to stop the pursuit of personal destruction and the prying into private lives and get on with our national life. Our country has been distracted by this matter for too long. And I take my responsibility for my part in all of this; this is all I can do. Now it is time—in fact, it is past time—to move on. We have important work to do, real opportunities to seize, real problems to solve, real security matters to face.

And so, tonight I ask you to turn away from the spectacle of the past 7 months, to repair the fabric of our national discourse, and to return our attention to all the challenges and all the promise of the next American century.

Thank you for watching, and good night.

    "
6,"
      Transcript
      First, let me thank you, Mr. President, and Vice President Kagame, and your wives for making Hillary and me and our delegation feel so welcome. I'd also like to thank the young students who met us and the musicians, the dancers who were outside. I thank especially the survivors of the genocide and those who are working to rebuild your country for spending a little time with us before we came in here.
I have a great delegation of Americans with me, leaders of our Government, leaders of our Congress, distinguished American citizens. We're all very grateful to be here. We thank the diplomatic corps for being here, and the members of the Rwandan Government, and especially the citizens.
I have come today to pay the respects of my Nation to all who suffered and all who perished in the Rwandan genocide. It is my hope that through this trip, in every corner of the world today and tomorrow, their story will be told; that 4 years ago in this beautiful, green, lovely land, a clear and conscious decision was made by those then in power that the peoples of this country would not live side by side in peace.
During the 90 days that began on April 6, in 1994, Rwanda experienced the most extensive slaughter in this blood-filled century we are about to leave—families murdered in their homes, people hunted down as they fled by soldiers and militia, through farmland and woods as if they were animals.
From Kibuye in the west to Kibungo in the east, people gathered seeking refuge in churches by the thousands, in hospitals, in schools. And when they were found, the old and the sick, the women and children alike, they were killed—killed because their identity card said they were Tutsi or because they had a Tutsi parent or because someone thought they looked like a Tutsi or slain, like thousands of Hutus, because they protected Tutsis or would not countenance a policy that sought to wipe out people who just the day before, and for years before, had been their friends and neighbors.
The Government-led effort to exterminate Rwanda's Tutsi and moderate Hutus, as you know better than me, took at last a million lives. Scholars of these sorts of events say that the killers, armed mostly with machetes and clubs, nonetheless did their work 5 times as fast as the mechanized gas chambers used by the Nazis.
It is important that the world know that these killings were not spontaneous or accidental. It is important that the world hear what your President just said: They were most certainly not the result of ancient tribal struggles. Indeed, these people had lived together for centuries before the events the President described began to unfold.
These events grew from a policy aimed at the systematic destruction of a people. The ground for violence was carefully prepared, the airwaves poisoned with hate, casting the Tutsis as scapegoats for the problems of Rwanda, denying their humanity. All of this was done, clearly, to make it easy for otherwise reluctant people to participate in wholesale slaughter.
Lists of victims, name by name, were actually drawn up in advance. Today, the images of all that, haunt us all: the dead choking the Kigara River, floating to Lake Victoria. In their fate, we are reminded of the capacity for people everywhere, not just in Rwanda, and certainly not just in Africa but the capacity for people everywhere, to slip into pure evil. We cannot abolish that capacity, but we must never accept it. And we know it can be overcome.
The international community, together with nations in Africa, must bear its share of responsibility for this tragedy, as well. We did not act quickly enough after the killing began. We should not have allowed the refugee camps to become safe havens for the killers. We did not immediately call these crimes by their rightful name: genocide. We cannot change the past, but we can and must do everything in our power to help you build a future without fear and full of hope.
We owe to those who died and to those who survived who loved them, our every effort to increase our vigilance and strengthen our stand against those who would commit such atrocities in the future, here or elsewhere. Indeed, we owe to all the peoples of the world who are at risk because each bloodletting hastens the next as the value of human life is degraded and violence becomes tolerated, the unimaginable becomes more conceivable—we owe to all the people in the world our best efforts to organize ourselves so that we can maximize the chances of preventing these events. And where they cannot be prevented, we can move more quickly to minimize the horror.
So let us challenge ourselves to build a world in which no branch of humanity, because of national, racial, ethnic, or religious origin, is again threatened with destruction because of those characteristics of which people should rightly be proud. Let us work together as a community of civilized nations to strengthen our ability to prevent and, if necessary, to stop genocide.
To that end, I am directing my administration to improve, with the international community, our system for identifying and spotlighting nations in danger of genocidal violence, so that we can assure worldwide awareness of impending threats. It may seem strange to you here, especially the many of you who lost members of your family, but all over the world there were people like me sitting in offices, day after day after day, who did not fully appreciate the depth and the speed with which you were being engulfed by this unimaginable terror.
We have seen, too—and I want to say again—that genocide can occur anywhere. It is not an African phenomenon and must never be viewed as such. We have seen it in industrialized Europe; we have seen it in Asia. We must have global vigilance. And never again must we be shy in the face of the evidence.
Secondly, we must, as an international community, have the ability to act when genocide threatens. We are working to create that capacity here in the Great Lakes region, where the memory is still fresh. This afternoon in Entebbe leaders from central and eastern Africa will meet with me to launch an effort to build a coalition to prevent genocide in this region. I thank the leaders who have stepped forward to make this commitment. We hope the effort can be a model for all the world, because our sacred task is to work to banish this greatest crime against humanity.
Events here show how urgent the work is. In the northwest part of your country, attacks by those responsible for the slaughter in 1994 continue today. We must work as partners with Rwanda to end this violence and allow your people to go on rebuilding your lives and your nation.
Third, we must work now to remedy the consequences of genocide. The United States has provided assistance to Rwanda to settle the uprooted and restart its economy, but we must do more. I am pleased that America will become the first nation to contribute to the new Genocide Survivors Fund. We will contribute this year $2 million, continue our support in the years to come, and urge other nations to do the same, so that survivors and their communities can find the care they need and the help they must have.
Mr. President, to you, and to you, Mr. Vice President, you have shown great vision in your efforts to create a single nation in which all citizens can live freely and securely. As you pointed out, Rwanda was a single nation before the European powers met in Berlin to carve up Africa. America stands with you, and will continue helping the people of Rwanda to rebuild their lives and society.
You spoke passionately this morning in our private meeting about the need for grassroots efforts, for the development projects which are bridging divisions and clearing a path to a better future. We will join with you to strengthen democratic institutions, to broaden participation, to give all Rwandans a greater voice in their own governance. The challenges you face are great, but your commitment to lasting reconciliation and inclusion is firm.
Fourth, to help ensure that those who survived, in the generations to come, never again suffer genocidal violence, nothing is more vital than establishing the rule of law. There can be no place in Rwanda that lasts without a justice system that is recognized as such.
We applaud the efforts of the Rwandan Government to strengthen civilian and military justice systems. I am pleased that our Great Lakes Justice Initiative will invest $30 million to help create throughout the region judicial systems that are impartial, credible, and effective. In Rwanda these funds will help to support courts, prosecutors, and police, military justice, and cooperation at the local level.
We will also continue to pursue justice through our strong backing for the International Criminal Tribunal for Rwanda. The United States is the largest contributor to this tribunal. We are frustrated, as you are, by the delays in the tribunal's work. As we know, we must do better. Now that administrative improvements have begun, however, the tribunal should expedite cases through group trials and fulfill its historic mission.
We are prepared to help, among other things, with witness relocation, so that those who still fear can speak the truth in safety. And we will support the war crimes tribunal for as long as it is needed to do its work, until the truth is clear and justice is rendered.
Fifth, we must make it clear to all those who would commit such acts in the future that they too must answer for their acts, and they will. In Rwanda, we must hold accountable all those who may abuse human rights, whether insurgents or soldiers. Internationally, as we meet here, talks are underway at the United Nations to establish a permanent international criminal court. Rwanda and the difficulties we have had with this special tribunal underscores the need for such a court. And the United States will work to see that it is created.
I know that in the face of all you have endured, optimism cannot come easily to any of you. Yet I have just spoken, as I said, with several Rwandans who survived the atrocities, and just listening to them gave me reason for hope. You see countless stories of courage around you every day as you go about your business here, men and women who survived and go on, children who recover the light in their eyes remind us that at the dawn of a new millennium there is only one crucial division among the peoples of the Earth. And believe me, after over 5 years of dealing with these problems, I know it is not the divisions between Hutu and Tutsi or Serb or Croatian; and Muslim and Bosnian or Arab and Jew; or Catholic and Protestant in Ireland, or black and white. It is really the line between those who embrace the common humanity we all share and those who reject it.
It is the line between those who find meaning in life through respect and cooperation and who, therefore, embrace someone to look down on, someone to trample, someone to punish and, therefore, embrace war. It is the line between those who look to the future and those who cling to the past. It is the line between those who give up their resentment and those who believe they will absolutely die if they have to release one bit grievance. It is the line between those who confront every day with a clenched fist and those who confront every day with an open hand. That is the only line that really counts when all is said and done.
To those who believe that God made each of us in His own image, how could we choose the darker road? When you look at those children who greeted us as we got off that plane today, how could anyone say they did not want those children to have a chance to have their own children, to experience the joy of another morning sunrise, to learn the normal lessons of life, to give something back to their people? When you strip it all away, whether we're talking about Rwanda or some other distant troubled spot, the world is divided according to how people believe they draw meaning from life.
And so I say to you, though the road is hard and uncertain and there are many difficulties ahead, and like every other person who wishes to help, I doubltless will not be able to do everything I would like to do, there are things we can do. And if we set about the business of doing them together, you can overcome the awful burden that you have endured. You can put a smile on the face of every child in this country, and you can make people once again believe that they should live as people were living who were singing to us and dancing for us today.
That's what we have to believe. That is what I came here to say. And that is what I wish for you.
Thank you, and God bless you.

    "
7,"
      Transcript
      Thank you. President and Mrs. Rawlings, honorable ministers, honorable members of the Council of State, honorable Members of Parliament, honorable members of the Judiciary, nananom [to the chiefs], and the people of Ghana. Mitsea mu. America fuo kyia mo [My greetings to you. Greetings from America]. Now you have shown me what akwaaba [welcome] really means. Thank you, thank you so much.
I am proud to be the first American President ever to visit Ghana and to go on to Uganda, Rwanda, South Africa, Botswana, and Senegal. It is a journey long overdue. America should have done it before, and I am proud to be on that journey. Thank you for welcoming me.
I want to listen and to learn. I want to build a future partnership between our two people, and I want to introduce the people of the United States, through my trip, to the new face of Africa. From Kampala to Cape Town, from Dakar to Dar-Es-Salaam, Africans are being stirred by new hopes for democracy and peace and prosperity.
Challenges remain, but they must be to all of you a call to action, not a cause for despair. You must draw strength from the past and energy from the promise of a new future. My dream for this trip is that together we might do the things so that, 100 years from now, your grandchildren and mine will look back and say this was the beginning of a new African renaissance.
With a new century coming into view, old patterns are fading away: The cold war is gone; colonialism is gone; apartheid is gone. Remnants of past troubles remain. But surely, there will come a time when everywhere reconciliation will replace recrimination. Now, nations and individuals finally are free to seek a newer world where democracy and peace and prosperity are not slogans but the essence of a new Africa.
Africa has changed so much in just 10 years. Dictatorship has been replaced so many places. Half of the 48 nations in sub-Saharan Africa choose their own governments, leading a new generation willing to learn from the past and imagine a future. Though democracy has not yet gained a permanent foothold even in most successful nations, there is everywhere a growing respect for tolerance, diversity, and elemental human rights. A decade ago, business was stifled. Now, Africans are embracing economic reform. Today from Ghana to Mozambique, from Cote d'Ivoire to Uganda, growing economies are fueling a transformation in Africa.
For all this promise, you and I know Africa is not free from peril: the genocide in Rwanda; civil wars in Sierra Leone, Liberia, both Congos; pariah states that export violence and terror; military dictatorship in Nigeria; and high levels of poverty, malnutrition, disease, illiteracy, and unemployment. To fulfill the vast promise of a new era, Africa must face these challenges. We must build classrooms and companies, increase the food supply and save the environment, and prevent disease before deadly epidemics break out.
The United States is ready to help you. First, my fellow Americans must leave behind the stereotypes that have warped our view and weakened our understanding of Africa. We need to come to know Africa as a place of new beginning and ancient wisdom from which, as my wife, our First Lady, said in her book, we have so much to learn. It is time for Americans to put a new Africa on our map.
Here in Independence Square, Ghana blazed the path of that new Africa. More than four decades ago, Kwame Nkrumah proposed what he called a ""motion of destiny"" as Ghana stepped forward as a free and independent nation. Today, Ghana again lights the way for Africa. Democracy is spreading. Business is growing. Trade and investment are rising. Ghana has the only African-owned company today on our New York Stock Exchange.
You have worked hard to preserve the peace in Africa and around the world—from Liberia to Lebanon, from Croatia to Cambodia. And you have given the world a statesman and peacemaker in Kofi Annan to lead the United Nations. The world admires your success. The United States admires your success. We see it taking root throughout the new Africa. And we stand ready to support it.
First, we want to work with Africa to nurture democracy, knowing it is never perfect or complete. We have learned in over 200 years that every day democracy must be defended and a more perfect union can always lie ahead. Democracy requires more than the insults and injustice and inequality that so many societies have known and America has known. Democracy requires human rights for everyone, everywhere, for men and women, for children and the elderly, for people of different cultures and tribes and backgrounds. A good society honors its entire family.
Second, democracy must have prosperity. Americans of both political parties want to increase trade and investment in Africa. We have an ""African Growth and Opportunity Act"" now before Congress. Both parties' leadership are supporting it. By opening markets and building businesses and creating jobs, we can help and strengthen each other. By supporting the education of your people, we can strengthen your future and help each other. For centuries, other nations exploited Africa's gold, Africa's diamonds, Africa's minerals. Now is the time for Africans to cultivate something more precious, the mind and heart of the people of Africa, through education.
Third, we must allow democracy and prosperity to take root without violence. We must work to resolve the war and genocide that still tear at the heart of Africa. We must help Africans to prevent future conflicts.
Here in Ghana, you have shown the world that different peoples can live together in harmony. You have proved that Africans of different countries can unite to help solve disputes in neighboring countries. Peace everywhere in Africa will give more free time and more money to the pressing needs of our children's future. The killing must stop if a new future is to begin.
Fourth and finally, for peace and prosperity and democracy to prevail, you must protect your magnificent natural domain. Africa is mankind's first home. We all came out of Africa. We must preserve the magnificent natural environment that is left. We must manage the water and forest. We must learn to live in harmony with other species. You must learn how to fight drought and famine and global warming. And we must share with you the technology that will enable you to preserve your environment and provide more economic opportunity to your people.
America has good reason to work with Africa: 30 million Americans, more than one in ten, proudly trace their heritage here. The first Peace Corps volunteers from America came to Ghana over 35 years ago; over 57,000 have served in Africa since then. Through blood ties and common endeavors, we know we share the same hopes and dreams to provide for ourselves and our children, to live in peace and worship freely, to build a better life than our parents knew and pass a brighter future on to our children. America needs Africa, America needs Ghana as a partner in the fight for a better future.
So many of our problems do not stop at any nation's border, international crime and terrorism and drug trafficking, the degradation of the environment, the spread of diseases like AIDS and malaria, and so many of our opportunities cannot stop at a nation's border. We need partners to deepen the meaning of democracy in America, in Africa, and throughout the world. We need partners to build prosperity. We need partners to live in peace. We will not build this new partnership overnight, but perseverance creates its own reward.
An Ashanti proverb tells us that by coming and going, a bird builds its nest. We will come and go with you and do all we can as you build the new Africa, a work that must begin here in Africa, not with aid or trade, though they are important, but first with ordinary citizens, especially the young people in this audience today. You must feel the winds of freedom blowing at your back, pushing you onward to a brighter future.
There are roughly 700 days left until the end of this century and the beginning of a new millennium. There are roughly 700 million Africans in sub-Saharan Africa. Every day and every individual is a precious opportunity. We do not have a moment to lose, and we do not have a person to lose.
I ask you, my friends, to let me indulge a moment of our shared history in closing. In 1957 our great civil rights leader, Martin Luther King, came to Accra to help represent our country as Ghana celebrated its independence. He was deeply moved by the birth of your nation.
Six years later, on the day after W.E.B. Du Bois died here in Ghana in 1963, Dr. King spoke to an enormous gathering like this in Washington. He said these simple words: ""I have a dream, a dream that all Americans might live free and equal as brothers and sisters."" His dream became the dream of our Nation and changed us in ways we could never have imagined. We are hardly finished, but we have traveled a long way on the wings of that dream.
Dr. Du Bois, a towering African-American intellectual, died here as a citizen of Ghana and a friend of Kwame Nkrumah. He once wrote, ""The habit of democracy must be to encircle the Earth."" Let us together resolve to complete the circle of democracy, to dream the dream that all people on the entire Earth will be free and equal, to begin a new century with that commitment to freedom and justice for all, to redeem the promise inscribed right here on Independence Arch. Let us find a future here in Africa, the cradle of humanity.
Medase. America dase [I thank you. America thanks you]. Thank you, and God bless you.

    "
